{
  "$schema": "https://wargamedata.com/aos4/schema/battle-tactic-card.schema.json",
  "id": "intercept-and-recover",
  "name": "Intercept and Recover",
  "affray": {
    "name": "Stolen Seedpod",
    "description": "You complete this battle tactic at the end of your turn if at least 1 enemy unit carrying a Ghyranite Treasure has been destroyed this battle."
  },
  "strike": {
    "name": "Contraband Aqua Ghyranis",
    "description": "You complete this battle tactic at the end of your turn if at least 2 enemy units carrying a Ghyranite Treasure have been destroyed this battle."
  },
  "domination": {
    "name": "Ley Line Taproot",
    "description": "You complete this battle tactic at the end of your turn if at least 3 enemy units carrying a Ghyranite Treasure have been destroyed this battle."
  },
  "_meta": {
    "lastUpdated": "2026-01-08",
    "source": "BSData import"
  },
  "cardRules": "• At the start of the battle, your opponent must pick 3 of their units on the battlefield to be carrying a Ghyranite Treasure. They cannot pick faction terrain features or Manifestations. A unit can only carry 1 Ghyranite Treasure. If your opponent has fewer than 3 units on the battlefield, you automatically complete a number of these battle tactics, starting with the **Domination** battle tactic (followed by the **Strike** and then the **Affray**) until the number of remaining uncompleted battle tactics equals the number of enemy units on the battlefield.\n• If you went second in the previous battle round and choose to go first in the current battle round, your opponent can remove 1 Ghyranite Treasure from one of their units at the start of the battle round.\n• If an ability would remove a unit that was carrying treasure from the battlefield and that unit is not set up again as part of the same ability (e.g. ‘Dark Apotheosis’ or ‘Red Ruin’), before removing that unit from the battlefield, your opponent must give the treasure it was carrying to another one of their units that does not have a Ghyranite treasure within 3\" of that unit. If this is not possible, that unit counts as having been destroyed for the purpose of this battle tactics card."
}
